{
  "slot_id":"ZH-04","candidate_version":1,"state":"accepted-pre-freeze",
  "construction_pass":{"result":"pass","notes":"Matches the frozen ZH-04 slot and requires inferring displacement from same-scope effective-rule language rather than an explicit supersedes label.","issues_found":[]},
  "adversarial_review_pass":{"result":"pass","notes":"No alternative controlling set found. R2 governs the same threshold scope as R1 and takes effect later; R3 is newer but governs a distinct submission requirement.","issues_found":[]},
  "schema_check":{"result":"pass","notes":"Canonical fields present; 3-record target satisfied."},
  "slot_match_check":{"result":"pass","notes":"Family, procurement domain, 3-record target, moderate difficulty, and inferred replacement vs recency cue all match the frozen matrix."},
  "gold_uniqueness_check":{"result":"pass","notes":"R2 uniquely controls the current threshold; R1 controls the historical query; R3 is authoritative only for a different scope."},
  "pilot_overlap_check":{"result":"pass","notes":"The newer distractor is an authoritative different-scope rule, not a current descriptive/non-authoritative source."},
  "leakage_check":{"result":"pass","notes":"Four renderings contain no answer-key metadata or condition-exclusive substantive hint."},
  "semantic_equivalence_check":{"result":"pass","notes":"All four renderings preserve identical canonical facts and questions; differences are field grouping only."},
  "scorer_determinism_check":{"result":"pass","notes":"Holdout scorer is deterministic by existing unit suite; ZH-04 fixture yields the expected all-correct result, flags R2+R3 as exact-set over-selection without stale/false-discard, and flags R1 as stale wrong-source with false-discard. No target model involved."},
  "repair_history":[],"rejection_reason":null,
  "accepted_reason":"All pre-freeze construction, overlap, rendering, leakage, equivalence, gold-uniqueness, and deterministic-scoring gates passed.",
  "target_model_execution_count":0
}