{
  "slot_id": "ZH-01",
  "candidate_version": 1,
  "state": "draft",
  "construction_pass": {"result":"pass","notes":"Matches the frozen ZH-01 slot: supersession, software configuration, 2 records, simple cue.","issues_found":[]},
  "adversarial_review_pass": {"result":"not_run","notes":"Pending separate adversarial review.","issues_found":[]},
  "schema_check": {"result":"pass","notes":"Candidate matches the canonical candidate schema by inspection."},
  "slot_match_check": {"result":"pass","notes":"Family, domain, record count, difficulty, and cue match the frozen matrix."},
  "gold_uniqueness_check": {"result":"pass","notes":"R2 explicitly replaces R1 before the current query; no alternative controlling set is supported."},
  "pilot_overlap_check": {"result":"not_run","notes":"Pending adversarial structural-overlap review."},
  "leakage_check": {"result":"not_run","notes":"Rendered conditions not yet generated."},
  "semantic_equivalence_check": {"result":"not_run","notes":"Rendered conditions not yet generated."},
  "scorer_determinism_check": {"result":"not_run","notes":"Scorer not yet constructed for holdout."},
  "repair_history": [],
  "rejection_reason": null,
  "accepted_reason": null,
  "target_model_execution_count": 0
}
