{"slot_id":"ZH-11","candidate_version":1,"state":"accepted-pre-freeze","target_model_execution_count":0,"construction_pass":{"result":"pass","notes":"Matches frozen temporary-rule/facilities/4+/compound extension-expiry-restoration slot.","issues_found":[]},"adversarial_review_pass":{"result":"pass","notes":"R2 is explicitly bounded to August and does not permanently replace R1. R4 only confirms the restoration already implied by R2's expiry, so the current authority remains R1 rather than R4. R3 governs room-sweep timing only. No alternative closing-time controlling set found.","issues_found":[]},"schema_check":{"result":"pass","notes":"Canonical fields present; four-record target satisfied."},"slot_match_check":{"result":"pass","notes":"Family, facilities-scheduling domain, 4+ records, compound difficulty, and extension-expiry-restoration cue all match ZH-11."},"gold_uniqueness_check":{"result":"pass","notes":"R1 uniquely controls current closing time; R2 uniquely controls the historical August closing time; R3/R4 do not create alternative closing-time values."},"pilot_overlap_check":{"result":"pass","notes":"The case tests bounded restoration and distinguishes a confirmation notice from operative authority. It does not reproduce the Pilot current descriptive/non-authoritative motif as the central challenge."},"leakage_check":{"result":"pass","notes":"All four renderings preserve R4's confirmation-only role and add no gold record IDs, answer-key metadata, or condition-exclusive hint."},"semantic_equivalence_check":{"result":"pass","notes":"Plain, Timestamp, Status, and T/T/E/A preserve all four canonical records and identical current/historical questions; differences are field grouping only."},"scorer_determinism_check":{"result":"pass","notes":"Deterministic fixture confirms R1-only is correct; R1+R4 and R1+R3 are exact-set over-selections without stale/false-discard; selecting expired R2 triggers stale wrong-source plus false-discard. No target model involved."},"repair_history":[],"rejection_reason":null,"accepted_reason":"All pre-freeze construction, overlap, rendering, leakage, equivalence, gold-uniqueness, and deterministic-scoring gates passed."}