{
  "slot_id":"ZH-16","candidate_version":1,"state":"accepted-pre-freeze","target_model_execution_count":0,
  "construction_pass":{"result":"pass","notes":"Matches frozen current-non-authoritative/publishing/2-record/moderate policy-vs-guidance slot.","issues_found":[]},
  "adversarial_review_pass":{"result":"pass","notes":"R1 uniquely sets the numeric abstract limit. R2 is current relevant guidance but non-numeric and expressly defers formal limits to policy.","issues_found":[]},
  "schema_check":{"result":"pass","notes":"Canonical fields present; two-record target satisfied."},
  "slot_match_check":{"result":"pass","notes":"All frozen ZH-16 properties match."},
  "gold_uniqueness_check":{"result":"pass","notes":"R1 alone controls and supplies 250 words at both query times."},
  "pilot_overlap_check":{"result":"pass","notes":"Frozen guidance-note family retained without making guidance a contradictory pseudo-policy."},
  "leakage_check":{"result":"pass","notes":"All four conditions preserve the same guidance deferral and non-controlling role; T/T/E/A adds no exclusive hint."},
  "semantic_equivalence_check":{"result":"pass","notes":"All four renderings preserve identical canonical facts and questions."},
  "scorer_determinism_check":{"result":"pass","notes":"Existing deterministic scorer plus ZH-16 fixture treats R1+R2 as exact-set over-selection without stale/false-discard and R2-only as false-discard without stale, matching current non-authoritative semantics."},
  "repair_history":[],"rejection_reason":null,"accepted_reason":"All pre-freeze gates passed without target-model execution."
}