{
  "slot_id":"ZH-09","candidate_version":1,"state":"draft","target_model_execution_count":0,
  "construction_pass":{"result":"pass","notes":"Matches frozen temporary-rule/service-operations/2-record/simple/restored-baseline slot.","issues_found":[]},
  "adversarial_review_pass":{"result":"pass","notes":"R2 is explicitly bounded and states that baseline resumes after expiry; it does not supersede R1. Current and historical query dates fall on opposite sides of the expiry boundary, yielding unique controlling records.","issues_found":[]},
  "schema_check":{"result":"pass","notes":"Canonical fields present; two-record target satisfied."},
  "slot_match_check":{"result":"pass","notes":"Family, domain, record count, difficulty, and competing cue match ZH-09."},
  "gold_uniqueness_check":{"result":"pass","notes":"R1 uniquely controls after expiry; R2 uniquely controls during its July window."},
  "pilot_overlap_check":{"result":"pass","notes":"Tests expiry/restoration rather than permanent supersession or current descriptive authority. The baseline remains valid across the lifecycle except during the bounded override."},
  "leakage_check":{"result":"not_run","notes":"Rendered conditions not yet generated."},"semantic_equivalence_check":{"result":"not_run","notes":"Rendered conditions not yet generated."},"scorer_determinism_check":{"result":"not_run","notes":"Pending rendering and scorer fixture."},
  "repair_history":[],"rejection_reason":null,"accepted_reason":null
}