{
  "slot_id":"ZH-06","candidate_version":1,"state":"draft","target_model_execution_count":0,
  "construction_pass":{"result":"pass","notes":"Matches frozen scoped-exception/membership/3-record/moderate/specificity-vs-recency slot.","issues_found":[]},
  "adversarial_review_pass":{"result":"pass","notes":"R2 specifically controls Harbor Plus issuance quantity. R3 is newer and authoritative, but only for transferability; recency cannot override the narrower quantity rule. No alternative controlling set found.","issues_found":[]},
  "schema_check":{"result":"pass","notes":"Canonical fields present; three-record target satisfied."},
  "slot_match_check":{"result":"pass","notes":"All five frozen slot properties match ZH-06."},
  "gold_uniqueness_check":{"result":"pass","notes":"R2 uniquely controls current quantity; R1 controls the historical query before R2's effective date; R3 changes a different benefit dimension."},
  "pilot_overlap_check":{"result":"pass","notes":"The newer record is independently authoritative for a different scope rather than descriptive/non-authoritative material; the case tests preregistered specificity-vs-recency."},
  "leakage_check":{"result":"not_run","notes":"Rendered conditions not yet generated."},"semantic_equivalence_check":{"result":"not_run","notes":"Rendered conditions not yet generated."},"scorer_determinism_check":{"result":"not_run","notes":"Pending rendering and scorer fixture."},
  "repair_history":[],"rejection_reason":null,"accepted_reason":null
}